	Section	Question1	Question2	Question3
0	1	s. Ut ultrices ultrices enim. Curabitur sit amet mauris. Morbi in dui quis est pulvinar ullamcorper. Nulla facilisi. Integer lacinia sollicitudin massa. Cras metu	t, consectetur adipiscing elit. Integer nec odio. Praesent libero. Sed cursus ante dapibus diam. Sed nisi. Nulla quis sem at nibh elementum imperdiet. Duis sagittis ipsum. Pra	 imperdiet. Maecenas aliquet mollis lectus. Vivamus consectetuer risus et tortor. L
1	1	ec odio. Praesent libero. Sed cursus ante dapibus diam. Sed nisi. Nulla quis sem at nibh eleme	r. Integer id quam. Morbi mi. Quisque nisl felis, venenatis tristique, dignissim in, ultrices sit amet, augue. Proin sodales libero eget ante. N	 ipsum ante quis turpis. Nulla f
2	1	a nostra, per inceptos himenaeos. Curabitur	at condimentum velit. Class aptent taciti sociosqu ad litora torquent per conubia n	 blandit dolor. Sed non quam. In vel mi sit amet augue congue element
3	1	sus quis, aliquet eget, justo. Sed pretium blandit orci. Ut eu diam at pede suscipit sodales. Aenean lectus elit, fermentum non, convallis id, sagittis at, neque. Nullam mauris orci, aliquet et, iaculis et, viverra vitae, ligula. Nulla ut felis in purus aliqu	ignissim in, ultrices sit amet, augue	, tortor neque adipiscing diam, a cursus ipsum ante quis turpis. Nulla facilisi. Ut fringilla. Suspe
4	1	porttitor, cursus quis, aliquet eget, justo. Sed pretium blandit orci. Ut eu diam at pede susci	nibh. Aenean quam. In scelerisque sem at dolor. Maecenas mattis. Sed convallis tristique sem. Proin ut ligula vel nunc egestas porttito	estibulum sapien. Proin quam. Etiam ultrices. Susp
5	1	pendisse in justo eu magna luctus suscipit. Sed lectus. Integer euismod lacus luctus magna. Quisque cursus, metus vitae pharetra auctor, sem massa mattis sem, at interdum magna augue eget diam. Vestibulum ante ipsum primis in faucibus orci lu	 per inceptos himenaeos. Curabitur sodales ligula in libero. Sed dignissim lacinia nunc. Curabitur tortor. Pellentesque nibh. Aenean quam. In scelerisque sem at dolor. Maecenas mattis. Sed convallis tristique sem. Proin ut ligula vel nunc egestas porttitor. Morbi lectus risus, iaculis vel, su	auris massa. Vestibulum lacinia arcu eget nulla. Class aptent taciti sociosqu ad litora torquent per conubia nostra, per inceptos himenaeos. Curabitur sodales ligula in libero. Sed dign
6	1	n ipsum sit amet pede facilisis lao	cus luctus magna. Quisque cursus, metus vitae pharetra auctor, sem massa mattis sem, at interdum magna augue eg	gna augue eget diam
7	1	lla metus metus, ullamcorper vel, tincidunt sed, euismod in, nibh	ec odio. Praesent libero. Sed cursus ante dapib	a, per inceptos himenaeos. Nam nec ante. Sed lacinia, urna non tincidunt mattis, tortor neque adipiscing diam, a cursus ipsum ante quis turpis. Nulla facilisi. Ut fringilla. Suspendisse potenti. Nunc feugiat mi a tellus consequat imperdiet. Vestibulum sapien. Proin quam. Etiam ultrices. Suspendisse in justo eu magna luct
8	1	sque sem at dolor. Maecenas mattis. Sed convallis tristique sem. Proin ut ligula vel nunc egestas porttitor. Morbi lectus risus, iaculis vel, suscipit quis, luctus non, massa. Fusce ac turpis q	or. Morbi lectus risus, iaculis vel, suscipit quis, luctus non, massa. Fusce ac turpis quis ligula lacinia aliquet. Mauris ipsum. Nulla metus	imenaeos. Nam nec ante. Sed lacinia, urna non tincidunt mattis, tortor neque adipiscing diam, a cursus ipsum ante quis turpis. Nulla facilisi. Ut frin
9	1	us, iaculis vel, suscipit quis, luctus non, massa. Fusce ac turpis quis ligula lacinia aliquet. Mauris ipsum. Nulla metus metus, ullamcorper vel, tincidunt sed, euismo	uris. Fusce nec tellus sed au	 mauris orci, aliquet et, iaculis et, viverra vitae, ligula. Nulla ut felis in purus aliquam imperdiet. Maecenas aliquet mollis lectus. Vivamu
10	1	inia molestie dui. Praesent blandit dolor. Sed non quam. In vel mi	d in, nibh. Quisque volutpat condimentum velit. Class aptent taciti sociosqu ad litora torquent per conubia nostra, per inceptos himenaeos. Nam nec ante. Sed lacinia, urna non tincidunt mattis, tortor neque adipiscing di	t felis in purus aliquam imperdiet. Maecenas aliquet mollis lectus. Vivamus consectetuer ri
11	1	se potenti. Nunc feugiat mi a tellus consequat imper	sodales ligula in libero. Sed dignissim lacinia nunc. Curabitur tortor. Pellentesque nibh. Aenean quam. In scelerisque sem at dolor. Maecenas mattis.	sum sit amet pede facilisis laoreet. D
12	1	 sagittis ipsum. Praesent mauris. F	ed convallis tristique sem. Proin ut ligula vel nunc egestas po	ss aptent taciti sociosqu ad litora torquent 
13	1	Curae; Morbi l	litora torquent per conubia nostra, per inceptos himenaeos. Nam nec ante. Sed lacinia, urna non tincidunt mattis, tortor neque adipiscing diam, a cursus ipsum ante quis turpis. Nulla facilisi. Ut fringilla. Suspendisse potenti. Nunc feugiat 	
14	1	ibulum lacinia	d dignissim lacinia nunc. Curabitur torto	
15	1	 felis in p	 porttitor. Morbi lectus risus, iaculis vel, suscipit quis, luctus non, massa. Fusce ac turpis quis ligula lacinia aliquet. Mauri	
16	1	 litora torquent per conubia nostra, per inceptos himenaeos. Curabitur sodales ligula in libero. Sed dig	erdiet. Maecenas aliquet mollis lectus. Vivamus consectetuer risus et tor	
17	1	uis sem at nibh elementum imperdiet. Duis sagittis ipsum	ales. Aenean lectus eli	
18	1	rttitor, cursus quis, aliquet eget, justo. Sed pretium blandit orci. Ut eu diam at pede suscipit sodales. Aenean lectus elit, fermentum non, convallis id, sagittis 	utpat condimentum velit. Class aptent taciti sociosqu ad litora torquent per conubia nostra, per inceptos himena	
19	1	rices posuere cubilia Curae; Morbi lacinia molestie dui. Praesent blandit dolor. Sed non quam. In 	Proin sodales libero eget ante. Nulla quam. Aenean laoreet. Vestib	
20	1	met pede facilisis laoreet. Donec lacus nun	. Morbi mi. Quisque nisl felis, venenatis tristique, dignissim in, ultrices sit amet, augue. Proin sodales libero eget ante. Nulla quam. Aenean laoreet. Vestibulum nisi lectus, commodo ac, f	
21	1	 potenti. Nunc feugiat m	assa mattis sem, a	
22	1	s massa. Vestibulum lacinia arcu eget nulla. Class aptent tac		
23	1	 tristique s		
24	1	tus metus, ullamcorper ve		
25	1	ndisse pote		
26	1	 aptent taciti sociosqu ad litora torquent per conubia nostra, per inceptos himenaeos. Curabitur sodales ligula in libero. Sed dignissim lacinia nunc. Curabitur to		
27	1	us. Integer euismod lacus luctus magna. Quisqu		
28	1	sum primis in faucibus orci luctus et ultrices posuere cubilia Cura		
29	1	r inceptos hi		
